Competitor,Annual Price,Monthly Option,Data Brokers,Dark Web Monitoring,Identity Theft Insurance,Credit Monitoring,Mobile App,Removal Screenshots,Custom Removals,Email Phone Masking,Free Tier,Third Party Audit,DNC Registry,Browser Extension,Automation Level,Family Plan,Key Differentiator
DeleteMe,$129,No,850+,Yes,No,No,No,No,40-60,Yes,Scan only,No,No,No,Hybrid,4 people,Longest-established brand with human specialists
Incogni,$95.88,Yes,420+,No,No,No,No,No,Unlimited,No,30-day refund,Deloitte,No,No,Full,5 people,Surfshark integration and Deloitte audit
Optery,$39-249,Yes,635+,No,No,No,No,Yes,Unlimited,No,Yes,No,No,No,Hybrid,Business only,Free tier and before/after screenshots
Privacy Bee,$95-799,Yes,860+,Pro+ only,No,No,No,No,Pro+ only,No,Assessment,No,No,Yes,Hybrid,Multi,Largest broker coverage claimed
Kanary,$179.88,Yes,310,No,No,No,Yes,No,Templates,Yes,14-day trial,ISO 27001,No,No,Full,10 people,Best free trial and mobile app
Aura,$144+,Yes,140+,Yes,Yes $1M,Yes,Yes,No,No,No,No,SOC 2,No,Yes,Full,Family plans,Identity protection suite with insurance
OneRep,$100,Yes,235,Add-on,No,Add-on,No,No,Limited,No,5-day trial,No,No,No,Full,6 people,Verification-first approach
GhostMyData,$71.88,Yes,58,Yes Enterprise,No,No,Planned,No,No,No,Yes,No,Yes,No,Full,5 people,Lowest price with DNC and breach monitoring
